{
  "$schema": "https://json-schema.org/draft/2020-12/schema",
  "$id": "https://creator-agent.local/schemas/visual_creator_profile.schema.json",
  "title": "VisualCreatorProfile",
  "description": "A stable configuration asset derived from Phase M4 visual distillation output, for consumption by a Creator Instance Factory. Contains no generation logic: prompts, model references, image data, and publish targets are rejected by shape.",
  "type": "object",
  "additionalProperties": false,
  "required": [
    "profile_version",
    "profile_id",
    "creator_id",
    "source_pattern_ids",
    "support",
    "confidence",
    "visual_identity",
    "composition_rules",
    "attention_strategy",
    "hierarchy_pattern",
    "constraints",
    "provenance",
    "notes"
  ],
  "properties": {
    "profile_version": {
      "type": "string"
    },
    "profile_id": {
      "type": "string"
    },
    "creator_id": {
      "type": "string"
    },
    "source_pattern_ids": {
      "type": "array",
      "minItems": 1,
      "items": {
        "type": "string"
      }
    },
    "support": {
      "type": "integer"
    },
    "confidence": {
      "type": "number"
    },
    "visual_identity": {
      "type": "object",
      "additionalProperties": false,
      "required": [
        "style_family",
        "visual_language",
        "complexity",
        "density",
        "contrast",
        "framing",
        "typography"
      ],
      "properties": {
        "style_family": {
          "type": "string"
        },
        "visual_language": {
          "type": "string",
          "enum": [
            "information_first",
            "subject_first",
            "data_first",
            "action_first",
            "undetermined"
          ]
        },
        "complexity": {
          "type": "string",
          "enum": [
            "low",
            "medium",
            "high",
            "undetermined"
          ]
        },
        "density": {
          "type": "string"
        },
        "contrast": {
          "type": "string"
        },
        "framing": {
          "type": "string"
        },
        "typography": {
          "type": "string"
        }
      }
    },
    "composition_rules": {
      "type": "object",
      "additionalProperties": false,
      "required": [
        "preferred",
        "forbidden"
      ],
      "properties": {
        "preferred": {
          "type": "array",
          "items": {
            "type": "string"
          }
        },
        "forbidden": {
          "type": "array",
          "items": {
            "type": "string"
          }
        }
      }
    },
    "attention_strategy": {
      "type": "object",
      "additionalProperties": false,
      "required": [
        "first"
      ],
      "properties": {
        "first": {
          "type": "string"
        },
        "second": {
          "type": "string"
        },
        "third": {
          "type": "string"
        },
        "fourth": {
          "type": "string"
        }
      }
    },
    "hierarchy_pattern": {
      "type": "object",
      "additionalProperties": false,
      "required": [
        "primary"
      ],
      "properties": {
        "primary": {
          "type": "string"
        },
        "secondary": {
          "type": "string"
        },
        "tertiary": {
          "type": "string"
        },
        "quaternary": {
          "type": "string"
        }
      }
    },
    "constraints": {
      "type": "object",
      "additionalProperties": false,
      "required": [
        "must_have",
        "avoid"
      ],
      "properties": {
        "must_have": {
          "type": "array",
          "items": {
            "type": "string"
          }
        },
        "avoid": {
          "type": "array",
          "items": {
            "type": "string"
          }
        }
      }
    },
    "provenance": {
      "type": "object",
      "additionalProperties": false,
      "required": [
        "visual_identity",
        "composition_rules",
        "attention_strategy",
        "hierarchy_pattern",
        "constraints"
      ],
      "properties": {
        "visual_identity": {
          "type": "object",
          "additionalProperties": false,
          "required": [
            "source",
            "derivation",
            "confidence",
            "evidence"
          ],
          "properties": {
            "source": {
              "type": "object",
              "additionalProperties": false,
              "required": [
                "phase",
                "artifact",
                "artifact_kind"
              ],
              "properties": {
                "phase": {
                  "type": "string",
                  "enum": [
                    "M4"
                  ]
                },
                "artifact": {
                  "type": "string"
                },
                "artifact_kind": {
                  "type": "string"
                }
              }
            },
            "derivation": {
              "type": "string",
              "enum": [
                "direct",
                "aggregated",
                "thresholded",
                "inverted",
                "enumerated_absent"
              ]
            },
            "confidence": {
              "type": "number"
            },
            "evidence": {
              "type": "object"
            }
          }
        },
        "composition_rules": {
          "type": "object",
          "additionalProperties": false,
          "required": [
            "source",
            "derivation",
            "confidence",
            "evidence"
          ],
          "properties": {
            "source": {
              "type": "object",
              "additionalProperties": false,
              "required": [
                "phase",
                "artifact",
                "artifact_kind"
              ],
              "properties": {
                "phase": {
                  "type": "string",
                  "enum": [
                    "M4"
                  ]
                },
                "artifact": {
                  "type": "string"
                },
                "artifact_kind": {
                  "type": "string"
                }
              }
            },
            "derivation": {
              "type": "string",
              "enum": [
                "direct",
                "aggregated",
                "thresholded",
                "inverted",
                "enumerated_absent"
              ]
            },
            "confidence": {
              "type": "number"
            },
            "evidence": {
              "type": "object"
            }
          }
        },
        "attention_strategy": {
          "type": "object",
          "additionalProperties": false,
          "required": [
            "source",
            "derivation",
            "confidence",
            "evidence"
          ],
          "properties": {
            "source": {
              "type": "object",
              "additionalProperties": false,
              "required": [
                "phase",
                "artifact",
                "artifact_kind"
              ],
              "properties": {
                "phase": {
                  "type": "string",
                  "enum": [
                    "M4"
                  ]
                },
                "artifact": {
                  "type": "string"
                },
                "artifact_kind": {
                  "type": "string"
                }
              }
            },
            "derivation": {
              "type": "string",
              "enum": [
                "direct",
                "aggregated",
                "thresholded",
                "inverted",
                "enumerated_absent"
              ]
            },
            "confidence": {
              "type": "number"
            },
            "evidence": {
              "type": "object"
            }
          }
        },
        "hierarchy_pattern": {
          "type": "object",
          "additionalProperties": false,
          "required": [
            "source",
            "derivation",
            "confidence",
            "evidence"
          ],
          "properties": {
            "source": {
              "type": "object",
              "additionalProperties": false,
              "required": [
                "phase",
                "artifact",
                "artifact_kind"
              ],
              "properties": {
                "phase": {
                  "type": "string",
                  "enum": [
                    "M4"
                  ]
                },
                "artifact": {
                  "type": "string"
                },
                "artifact_kind": {
                  "type": "string"
                }
              }
            },
            "derivation": {
              "type": "string",
              "enum": [
                "direct",
                "aggregated",
                "thresholded",
                "inverted",
                "enumerated_absent"
              ]
            },
            "confidence": {
              "type": "number"
            },
            "evidence": {
              "type": "object"
            }
          }
        },
        "constraints": {
          "type": "object",
          "additionalProperties": false,
          "required": [
            "source",
            "derivation",
            "confidence",
            "evidence"
          ],
          "properties": {
            "source": {
              "type": "object",
              "additionalProperties": false,
              "required": [
                "phase",
                "artifact",
                "artifact_kind"
              ],
              "properties": {
                "phase": {
                  "type": "string",
                  "enum": [
                    "M4"
                  ]
                },
                "artifact": {
                  "type": "string"
                },
                "artifact_kind": {
                  "type": "string"
                }
              }
            },
            "derivation": {
              "type": "string",
              "enum": [
                "direct",
                "aggregated",
                "thresholded",
                "inverted",
                "enumerated_absent"
              ]
            },
            "confidence": {
              "type": "number"
            },
            "evidence": {
              "type": "object"
            }
          }
        }
      }
    },
    "notes": {
      "type": "array",
      "items": {
        "type": "string"
      }
    }
  }
}
