{
  "profile_version": "m5.0.0",
  "profile_id": "vcp-dc6e25db6aee5e60",
  "creator_id": "creator_d",
  "source_pattern_ids": [
    "strategy-family-creator_d__T06_cover_with_logo__00-creator_d__T06_cover_with_logo__01"
  ],
  "support": 2,
  "confidence": 0.7,
  "visual_identity": {
    "style_family": "low_contrast__dense__full_bleed",
    "visual_language": "subject_first",
    "complexity": "low",
    "density": "dense",
    "contrast": "low_contrast",
    "framing": "full_bleed",
    "typography": "undetermined"
  },
  "composition_rules": {
    "preferred": [
      "full_bleed_subject"
    ],
    "forbidden": [
      "central_subject",
      "offset_subject",
      "top_entry",
      "bottom_anchor",
      "overlay_headline",
      "split_columns",
      "stacked_information",
      "centred_information"
    ]
  },
  "attention_strategy": {
    "first": "subject"
  },
  "hierarchy_pattern": {
    "primary": "undetermined"
  },
  "constraints": {
    "must_have": [
      "background_background",
      "background_center_mid",
      "background_dense",
      "background_encloses_all",
      "background_present",
      "low_contrast_blend",
      "primary_focus:subject",
      "subject_center_mid",
      "subject_dense",
      "subject_first",
      "subject_full_bleed",
      "subject_present",
      "subject_primary"
    ],
    "avoid": [
      "missing_information_support",
      "unclear_entry_point"
    ]
  },
  "provenance": {
    "attention_strategy": {
      "source": {
        "phase": "M4",
        "artifact": "strategy-family-creator_d__T06_cover_with_logo__00-creator_d__T06_cover_with_logo__01",
        "artifact_kind": "CreatorStrategyPattern"
      },
      "derivation": "direct",
      "confidence": 0.866667,
      "evidence": {
        "attention_support": [
          1.0
        ]
      }
    },
    "composition_rules": {
      "source": {
        "phase": "M4",
        "artifact": "strategy-family-creator_d__T06_cover_with_logo__00-creator_d__T06_cover_with_logo__01",
        "artifact_kind": "CreatorStrategyPattern"
      },
      "derivation": "enumerated_absent",
      "confidence": 0.866667,
      "evidence": {
        "moves_present": [
          "full_bleed_subject"
        ],
        "moves_absent": [
          "central_subject",
          "offset_subject",
          "top_entry",
          "bottom_anchor",
          "overlay_headline",
          "split_columns",
          "stacked_information",
          "centred_information"
        ],
        "vocabulary_size": 9
      }
    },
    "constraints": {
      "source": {
        "phase": "M4",
        "artifact": "constraint-strategy-family-creator_d__T06_cover_with_logo__00-creator_d__T06_cover_with_logo__01",
        "artifact_kind": "VisualConstraint"
      },
      "derivation": "thresholded",
      "confidence": 0.7,
      "evidence": {
        "constraint_count": 1,
        "must_have_features": [
          "background_background",
          "background_center_mid",
          "background_dense",
          "background_encloses_all",
          "background_present",
          "low_contrast_blend",
          "primary_focus:subject",
          "subject_center_mid",
          "subject_dense",
          "subject_first",
          "subject_full_bleed",
          "subject_present",
          "subject_primary"
        ],
        "must_have_frequency": 0.85
      }
    },
    "hierarchy_pattern": {
      "source": {
        "phase": "M4",
        "artifact": "strategy-family-creator_d__T06_cover_with_logo__00-creator_d__T06_cover_with_logo__01",
        "artifact_kind": "CreatorStrategyPattern"
      },
      "derivation": "direct",
      "confidence": 0.866667,
      "evidence": {
        "strategies": [
          "subject_first"
        ],
        "support": 2
      }
    },
    "visual_identity": {
      "source": {
        "phase": "M4",
        "artifact": "strategy-family-creator_d__T06_cover_with_logo__00-creator_d__T06_cover_with_logo__01",
        "artifact_kind": "CreatorStrategyPattern+VisualGrammar"
      },
      "derivation": "aggregated",
      "confidence": 0.8,
      "evidence": {
        "style_traits": [
          "background_dense",
          "subject_dense"
        ],
        "average_region_area": 0.843573,
        "attention_strategy": [
          "subject_first"
        ]
      }
    }
  },
  "notes": [
    "derived from 1 M4 strategy pattern(s) over 2 grammar(s)",
    "forbidden composition set rests on 2 supporting observations; absence over a small sample is weaker evidence than presence",
    "forbidden moves are the composition vocabulary entries no cluster member exhibited, not moves observed to be avoided"
  ]
}
