{
  "profile_version": "m5.0.0",
  "profile_id": "vcp-0ec3d69b4137e0f0",
  "creator_id": "creator_b",
  "source_pattern_ids": [
    "strategy-family-creator_b__T02_top_image_bottom_text__00-creator_b__T02_top_image_bottom_text__01-creator_e__T02_top_image_bottom_text__00-creator_e__T02_top_image_bottom_text__01-creator_e__T02_top_image_bottom_text__02"
  ],
  "support": 5,
  "confidence": 0.7,
  "visual_identity": {
    "style_family": "low_contrast__dense__full_bleed",
    "visual_language": "subject_first",
    "complexity": "low",
    "density": "dense",
    "contrast": "low_contrast",
    "framing": "full_bleed",
    "typography": "undetermined"
  },
  "composition_rules": {
    "preferred": [
      "central_subject"
    ],
    "forbidden": [
      "offset_subject",
      "full_bleed_subject",
      "top_entry",
      "bottom_anchor",
      "overlay_headline",
      "split_columns",
      "stacked_information",
      "centred_information"
    ]
  },
  "attention_strategy": {
    "first": "subject",
    "second": "cta",
    "third": "cta"
  },
  "hierarchy_pattern": {
    "primary": "action"
  },
  "constraints": {
    "must_have": [
      "background_background",
      "background_center_mid",
      "background_dense",
      "background_encloses_all",
      "background_present",
      "cta_center_mid",
      "cta_present",
      "cta_secondary",
      "cta_sparse",
      "low_contrast_blend",
      "subject_center_focus",
      "subject_dense",
      "subject_first",
      "subject_present",
      "subject_primary",
      "subject_top_mid"
    ],
    "avoid": [
      "missing_information_support"
    ]
  },
  "provenance": {
    "attention_strategy": {
      "source": {
        "phase": "M4",
        "artifact": "strategy-family-creator_b__T02_top_image_bottom_text__00-creator_b__T02_top_image_bottom_text__01-creator_e__T02_top_image_bottom_text__00-creator_e__T02_top_image_bottom_text__01-creator_e__T02_top_image_bottom_text__02",
        "artifact_kind": "CreatorStrategyPattern"
      },
      "derivation": "direct",
      "confidence": 0.92,
      "evidence": {
        "attention_support": [
          1.0
        ]
      }
    },
    "composition_rules": {
      "source": {
        "phase": "M4",
        "artifact": "strategy-family-creator_b__T02_top_image_bottom_text__00-creator_b__T02_top_image_bottom_text__01-creator_e__T02_top_image_bottom_text__00-creator_e__T02_top_image_bottom_text__01-creator_e__T02_top_image_bottom_text__02",
        "artifact_kind": "CreatorStrategyPattern"
      },
      "derivation": "enumerated_absent",
      "confidence": 0.92,
      "evidence": {
        "moves_present": [
          "central_subject"
        ],
        "moves_absent": [
          "offset_subject",
          "full_bleed_subject",
          "top_entry",
          "bottom_anchor",
          "overlay_headline",
          "split_columns",
          "stacked_information",
          "centred_information"
        ],
        "vocabulary_size": 9
      }
    },
    "constraints": {
      "source": {
        "phase": "M4",
        "artifact": "constraint-strategy-family-creator_b__T02_top_image_bottom_text__00-creator_b__T02_top_image_bottom_text__01-creator_e__T02_top_image_bottom_text__00-creator_e__T02_top_image_bottom_text__01-creator_e__T02_top_image_bottom_text__02",
        "artifact_kind": "VisualConstraint"
      },
      "derivation": "thresholded",
      "confidence": 0.7,
      "evidence": {
        "constraint_count": 1,
        "must_have_features": [
          "background_background",
          "background_center_mid",
          "background_dense",
          "background_encloses_all",
          "background_present",
          "cta_center_mid",
          "cta_present",
          "cta_secondary",
          "cta_sparse",
          "low_contrast_blend",
          "subject_center_focus",
          "subject_dense",
          "subject_first",
          "subject_present",
          "subject_primary",
          "subject_top_mid"
        ],
        "must_have_frequency": 0.85
      }
    },
    "hierarchy_pattern": {
      "source": {
        "phase": "M4",
        "artifact": "strategy-family-creator_b__T02_top_image_bottom_text__00-creator_b__T02_top_image_bottom_text__01-creator_e__T02_top_image_bottom_text__00-creator_e__T02_top_image_bottom_text__01-creator_e__T02_top_image_bottom_text__02",
        "artifact_kind": "CreatorStrategyPattern"
      },
      "derivation": "direct",
      "confidence": 0.92,
      "evidence": {
        "strategies": [
          "subject_first"
        ],
        "support": 5
      }
    },
    "visual_identity": {
      "source": {
        "phase": "M4",
        "artifact": "strategy-family-creator_b__T02_top_image_bottom_text__00-creator_b__T02_top_image_bottom_text__01-creator_e__T02_top_image_bottom_text__00-creator_e__T02_top_image_bottom_text__01-creator_e__T02_top_image_bottom_text__02",
        "artifact_kind": "CreatorStrategyPattern+VisualGrammar"
      },
      "derivation": "aggregated",
      "confidence": 0.825,
      "evidence": {
        "style_traits": [
          "background_dense",
          "cta_sparse",
          "subject_dense"
        ],
        "average_region_area": 0.314223,
        "attention_strategy": [
          "subject_first"
        ]
      }
    }
  },
  "notes": [
    "derived from 1 M4 strategy pattern(s) over 5 grammar(s)",
    "forbidden composition set rests on 5 supporting observations; absence over a small sample is weaker evidence than presence",
    "forbidden moves are the composition vocabulary entries no cluster member exhibited, not moves observed to be avoided"
  ]
}
